tweet_id,text,labels
768536816165146624,"Injuries &amp; 120 dead in ItalyOne mayor say his town ""isn't here anymore"" 6.2quake turns picturesque towns to ruins. https://t.co/hIpxUES8Xh","[0, 0, 1, 0]"
768520053922889728,The death toll in Italy has risen to at least 120with more than 300 injuredafter a quake: https://t.co/XFYr4GKs5S https://t.co/oyVXMrU3Ax,"[0, 0, 1, 0]"
768546975851515904,"Italy earthquake leaves at least 120 dead, rescuers racing against time - CNN: CNNItaly earthquake leaves at least 120 dead, rescuers...","[0, 0, 1, 0]"
768559766369075200,Earthquake Of Italy At least 120 Dead: https://t.co/nuQ4lp9F2J via @YouTube,"[0, 0, 1, 0]"
768536177746018306,"express deep condolences to @ItalyinNed over the losses in #earthquake in #Italy,wish quick recovery to the injured! https://t.co/S5RYVF4d0r","[0, 0, 1, 0]"
768545892924215296,The death toll from the quake in Italy has risen to at least 120 with more than 360 people injured https://t.co/bYXYRBzxgW,"[0, 0, 1, 0]"
768556515330449408,"Italy: Death toll is estimated ""at least 120"".100s injured,towns razed. Over 200 aftershocks.https://t.co/LQoclnAmVC https://t.co/ATz7Qe6VX3","[0, 0, 1, 0]"
768521224209051649,Officials now say 120 are dead in Italian earthquake https://t.co/0c8UM02bSZ,"[0, 0, 1, 0]"
768520663627890688,Updated death and injury toll from the Italian earthquake skyrockets  https://t.co/g4ClcJi5RA,"[0, 0, 1, 0]"
768567230862860288,"No reports of Australians dead or injured to date in Italy earthquake, says Malcolm Turnbull. Live blog: https://t.co/9efUgpKU6f","[0, 0, 1, 0]"
768582244294242304,Italy earthquake: Death toll rises to at least 159: At least 159 people have been killed and more than 360 injured in a 6.2-magnitude...,"[0, 0, 1, 0]"
768571590191751172,"More @cbcnews At least 159 dead, hundreds more injured as powerful earthquake reduces 3 Italian towns to rubble: https://t.co/fgFrGf8Lhb","[0, 0, 1, 0]"
768565474091212801,Death toll now 159 - Italian Civic Protection Authority. #italy #earthquake,"[0, 0, 1, 0]"
768563868721438720,my uncle has been injured by this earthquake in Italy I'm fucking shaking . I don't want my nonna &amp; nonno to get hurt,"[0, 0, 1, 0]"
768575040807895040,@dreamy5sosfam magnitude 6.1 earthquake and 159 dead people,"[0, 0, 1, 0]"
768578580305502208,"Major earthquake hits Italy.  So far over 160 dead, more injured. Deaths totals still rising. Many homes... https://t.co/3GqanGCiq9","[0, 0, 1, 0]"
768562351679344640,'Complete devastation': Dozens dead after quake rocks Italy https://t.co/m7MiDfWyc6,"[0, 0, 1, 0]"
768564956577075200,Increase to 159 deaths from the earthquake in Italy :_(,"[0, 0, 1, 0]"
768567719729827840,#ALERT - BREAKING NEWS - Death toll from earthquake in Italy rises to 159; more than 360 injured - via nbcnews,"[0, 0, 1, 0]"
768579943424888833,"ItalyEarthquake death toll now at 159, authorities say https://t.co/i4Vqytyqny","[0, 0, 1, 0]"
768581051123924992,".@PerriHockema hello, the town is NOT destroyed. No damages have been reported in Montepulciano, which was not affected by the earthquake.","[0, 0, 1, 0]"
768579667632664576,Death toll continues to rise in Italy earthquake as authorities confirm 159 dead. https://t.co/GEz2FX5cdn #Amatrice,"[0, 0, 1, 0]"
768568114586017792,"NBCNews - Death toll rises to 159 in Italy earthquake, more than 360 injured The 6.2 magnitude quake struck about... https://t.co/EEPeMS5sMa","[0, 0, 1, 0]"
768579346147733505,#Italy #earthquake:   Italian Authority update tonight the number of dead 159,"[0, 0, 1, 0]"
768560347959726080,Death toll reaches 120 in Italian earthquake  As the death toll continues to rise in t https://t.co/VamqHw0bkW... https://t.co/N0JIV46zAb,"[0, 0, 1, 0]"
768570989978550276,#UPDATE: Italy earthquake death toll increases to at least 159 people. https://t.co/6ZiSFFKCTe,"[0, 0, 1, 0]"
768577398707216384,"rt TBN@TBN Pray w/ us for those devastated by the earthquake in Italy. Over 120 dead, many hurting &amp; homeless. #PrayForItaly","[0, 0, 1, 0]"
768568821204549632,"It s a tragedy; Death toll rises to 159 in Italy earthquake, more than 360 injured https://t.co/qDuvBz9IK8 via @nbcnews","[0, 0, 1, 0]"
768583699210211329,Local church members and ADRA spring into action after #ItalyEarthquake. No Adventists known injured. https://t.co/a9YmdWeFQO,"[0, 0, 1, 0]"
768589758322778112,Italy quake death toll passes 20 https://t.co/spmAb6NQAb,"[0, 0, 1, 0]"
768559929992949761,#Tragic -&gt; At Least 73 Dead As Earthquake Rocks Central Italy Dozens Dead in... https://t.co/UZ4hAoLpCI https://t.co/3qIqpwSHcb,"[0, 0, 1, 0]"
768581530746773504,#ItalyEarthquake: #Death Toll Rises To At Least 159 -- 368 Injured  https://t.co/3peCTFXtPN #Italy #ItalyQuake #Terremoto #EarthQuake,"[0, 0, 1, 0]"
768567570123268096,159 people confirmed dead in the Italian earthquake. Horrible.,"[0, 0, 1, 0]"
768580159750434816,Italy earthquake death toll now at 159 - WESH Orlando - WESH Orlando Italy earthquake death toll now at 159 WES... https://t.co/iSjri33goh,"[0, 0, 1, 0]"
768575412049850368,it is truly devastating about the earthquake in italy. sending our thoughts to those injured emotionally and physically. #ItalyEarthquake ,"[0, 0, 1, 0]"
768561408455958529,"Hey @Leon_Chiro sorry about the earthquake, hope no family or friends of yours had suffer any damage :(","[0, 0, 1, 0]"
768585821377089536,^~^ WATCH:  Death Toll Climbs to 159 After Earthquake in Italy  |,"[0, 0, 1, 0]"
768567616403234816,News hit: The death toll from Italy's earthquake has risen to 159.,"[0, 0, 1, 0]"
768564538832805892,A huge earthquake happened in Italy leaving around 21 casualties. I'm alright and safe ,"[0, 0, 1, 0]"
768578277338329088," ""At least 159 dead following earthquake in Italy"" The dead count really climbed since this morning ..Terrible .  https://t.co/tJ3lsMEURz","[0, 0, 1, 0]"
768567753846456320,"UPDATE: Death toll rises to 159 after Italy quake, more than 360 injured. #ItalyEarthquake","[0, 0, 1, 0]"
768571623452635136,"Quake: at least 120 killed, hundreds injured and towns razed | Italy https://t.co/uLU8fTGsWv","[0, 0, 1, 0]"
768588382448386048,@LeifCaesar bro there was a earthquake in Italy 159 people pass and 368 are injured how sad,"[0, 0, 1, 0]"
768588972767444992,"@kaputsky btw,the earthquake was 24h ago,it's true,but there are still missing and injured people,we need blood &amp;help from all the Italians","[0, 0, 1, 0]"
768572527991861248,No Filipino casualties in Italy earthquake | New Day live https://t.co/CaczwF9CtH,"[0, 0, 1, 0]"
768580186384113664,"@meggy Hello, I'm writing from Montepulciano. Our town and the area have NOT been affected by the earthquake, no damages reported.","[0, 0, 1, 0]"
768589115625472000,Death toll in Italian earthquake has risen to 159 with hundreds more injured: https://t.co/XlURvOxN7W https://t.co/VCKAyb9TmL,"[0, 0, 1, 0]"
768569882787143680,"QT ""RT NBCNews: Death toll rises to 159 in #ItalyEarthquake, more than 360 injured https://t.co/XKFKtwLlYs https://t.co/9zNGVrTMud","[0, 0, 1, 0]"
768568734919319556,"At least 120 people have been killed and 368 injured in an earthquake that hit a mountainous area of central Italy, PM Matteo Renzi has sai...","[0, 0, 1, 0]"
768587203077255168,"My sister is in Italy, a record just earthquake shook the entire country. Several casualties...she slept through the whole thing had no clue","[0, 0, 1, 0]"
768590410281316353,"Replying to several requests of information: #Montepulciano has NOT been affected by the earthquake, no damages reported in town.","[0, 0, 1, 0]"
768561863370104832,Italy has been hit by a deadly 6.2 earthquake. Many are injured and feared dead. Entire towns have been wiped... https://t.co/bJVdzW7Vtc,"[0, 0, 1, 0]"
768587292134866947,UI seismometer picks up Italy earthquake: More than 100 are dead and hundreds more are wounded after a 6.2 ma... https://t.co/eJN75NCjd0,"[0, 0, 1, 0]"
768580003764121600,URGENT  Italy earthquake deaths at 159 https://t.co/wCsqWwgsJT,"[0, 0, 1, 0]"
768574829406674944,"In Abruzzo, Italy. Woke up to the sound of helicopters this morning. Now realize they were probably transporting injured from earthquake.","[0, 0, 1, 0]"
768594067290624000,"No Aussies killed, injured in Italy quake | SBS News https://t.co/rbQL8FIWxt He's doing an Abbott! How would he Know? They don't even know!","[0, 0, 1, 0]"
768596171812139008,Death toll has risen to at least159 &amp; 368 injured in devastating earthquake in #Italy according to Civil Protection Agency. #PrayForItaly,"[0, 0, 1, 0]"
768606938170961920,Death Toll Climbs to 159 After Earthquake in Italy: Death Toll Climbs to 159 After Earthquake in Italy. More.... https://t.co/tuCYz4bzQK,"[0, 0, 1, 0]"
768606349236195328,BREAKING NEWS: 159 killed and 368 injured in earthquake in Italy https://t.co/308jCIxKMq,"[0, 0, 1, 0]"
768601179307798528,"Sadly, the death toll keeps rising  - BBC News - #Italy #earthquake: Death toll rises to at least 159 https://t.co/HTgTgKYDiA","[0, 0, 1, 0]"
768609816071766016,"@leedsdagger #PrayForItaly 260 dead &amp;injured and 90 disappear. earthquake 6,3 R","[0, 0, 1, 0]"
768597565411438592,"APTOPIX Italy Quake  This aerial photo shows the damaged buildings in the town of Amatrice, central Italy, after... https://t.co/UCBellKdNe","[0, 0, 1, 0]"
768618675955834880,"3 of 4 Yet, relatively few buildings were destroyed or damaged by the #earthquake. Almost all of the damage was done by the tsunami.","[0, 0, 1, 0]"
768610855831437312,"#PrayForItaly earthquake 6,3R near Roma. over 260 dead and injured and 90 disappeared. https://t.co/ZiPDgLYRWs","[0, 0, 1, 0]"
768611525175029760,Toll in #Italy #earthquake rises to at least 159 dead and 360 wounded https://t.co/4Ygmnq61qm Only 1 death reported from #MyanmarEarthquake,"[0, 0, 1, 0]"
768606780108730368,@thSouthAfricanD At least 159 people have been killed and 368 injured in an earthquake that hit a mountainous area of central Italy.,"[0, 0, 1, 0]"
768608108780355585,"A powerful earthquake shook central Italy, leaving at least 159 people dead and 368 people injured. https://t.co/zUYsK2ojmU","[0, 0, 1, 0]"
768603280922423297,"Italy: Earthquake Death Toll Rises To 159, Hundreds More Injured - https://t.co/Zj93xG3Crz - #World https://t.co/Ckdvt3GEHn","[0, 0, 1, 0]"
768607265158991872,"Aerial photo shows the damaged buildings in the town of Amatrice, central Italy, after a 6.2 magnitude earthquake https://t.co/8l8o5vSNwq","[0, 0, 1, 0]"
768605030995922945,Central Italy Earthquake:159 Dead And More Than 360 injured in a 6.2 Magnitude Says Civil Protection Officials. https://t.co/EIYtFolicf,"[0, 0, 1, 0]"
768611618326470656,And now more than 159 victims due to the Italian Earthquake and how many injured....No wor... https://t.co/eaRxgNizVr https://t.co/U7tz6ZH2hd,"[0, 0, 1, 0]"
768594211495153664,Vatican Announces. They Will Pay For Cost Of Rebuilding Towns And Cities Damaged By Recent Earthquake. Wow. https://t.co/vIUbCA4Otz,"[0, 0, 1, 0]"
768602966550917121,"Retweeted CBC News Alerts (@CBCAlerts):  More @cbcnews At least 159 dead, hundreds more injured as powerful... https://t.co/qg3DluzmzC","[0, 0, 1, 0]"
768597407055638529,"After Earthquake in Italy, Half the Town No Longer Exists 120 dead, many more injured  https://t.co/DXNh6srIUI","[0, 0, 1, 0]"
768593022602784769,No Malaysians were injured in the deadly earthquake in Italy yesterday.  Wisma Putra says it is in close contact... https://t.co/mG6eTmweHI,"[0, 0, 1, 0]"
768669840731049985, ITALY DEATH TOLL RISES TO 247 |..civil protection agency says. 368 injured. https://t.co/lxpIVR0aQH,"[0, 0, 1, 0]"
768665148169084928,"Powerful quake hits central Italy, more than 150 dead.  https://t.co/Skp74oNmj7","[0, 0, 1, 0]"
768639767726661632,Central Italy earthquake: death toll rises to 120  as it happened | World news | The Guardian 159 deaths now..  https://t.co/5JD8DcM5KK,"[0, 0, 1, 0]"
768674252648124416,Death tool rises to 247..#italy earthquake https://t.co/GGAHufsUK3,"[0, 0, 1, 0]"
768680601390026754,Italy earthquake: death toll soars to 247 as rescuers race to find survivors:    The death toll from a powerf...... https://t.co/5iU11qdZDu,"[0, 0, 1, 0]"
768670199356661760,"Death toll in Italy earthquake rises to 247, official - RTRS","[0, 0, 1, 0]"
768663692259000320,Waking up on news that Italy earthquake death toll tops 160 &amp;368 injured. Search for others continues. Too sad! May God be with Italians,"[0, 0, 1, 0]"
768654464593096704,"Casualties have more than doubled and reached the number of 159 since our earlier request for prayer, and rescue... https://t.co/NiXVCLnTHX","[0, 0, 1, 0]"
768679692224299008," #Tornado #DisasterPreparedness: After Major #Hurricane, #Earthquake: NO Freeways, NO Electricity, NO... https://t.co/DSHYdqQBGT","[0, 0, 1, 0]"
768660992985210881,#ItalyEarthquake leaves 159 dead; towns ruined. .@CNN https://t.co/cRkesFXtJV,"[0, 0, 1, 0]"
768658068309585920,"Video: Central Italy earthquake,159 people dead. https://t.co/bxdbiCe0Eu","[0, 0, 1, 0]"
768634630316691456,@amanda_moore17 150+ dead due to an earthquake :/,"[0, 0, 1, 0]"
768674359414296576,Italy earthquake leaves 247 dead; rescuers racing against time - CNN: CNNItaly earthquake leaves 247 dead; rescuers racing against ti...,"[0, 0, 1, 0]"
768667818183172096,#Italy #earthquake death toll rises to 159: Reports https://t.co/yjaUhesI27,"[0, 0, 1, 0]"
768665208860581888,Civil protection now confirms to @CNN 247 dead in Italy earthquake. #amatrice,"[0, 0, 1, 0]"
768631564708171776,The Latest: Fewer casualties likely in quake damaged hotel: The Latest on the earthquake in central Italy (al... https://t.co/un8hmWhtYg,"[0, 0, 1, 0]"
768670569122373632,The Latest: Italian officials say quake death toll hits 247  https://t.co/XfqbeC9qPb An entire town gone &amp; 247 dead! Pray,"[0, 0, 1, 0]"
768651630829006848,"Italy quake kills over 150, damages buildings Read more @ https://t.co/OhQ4R1UOuK Watch: https://t.co/CYLjJiwsWV","[0, 0, 1, 0]"
768666344137039872,"Death Toll Of Italy 2016 Earthquake: 159 Killed, 368 Injured, Italian PM Says Figures... https://t.co/BjKh5WMkug","[0, 0, 1, 0]"
768675272727994368,Art experts fear serious earthquake damage to historic Italian buildings: Art experts fear numerous ... https://t.co/TVcoptUr0G #Italian,"[0, 0, 1, 0]"
768660893122990080,"#ItalyEarthquake : Death toll rises to 159, 368 injured https://t.co/7lZPHFrGiu","[0, 0, 1, 0]"
768630718624694272,"Italy earthquake leaves at least 21 dead, 'significant casualties' likely","[0, 0, 1, 0]"
768654397416943616,Italy earthquake leaves 159 dead; towns ruined Italy earthquake leaves 159 dead; towns ruined -... https://t.co/ZEYy6CHU4y,"[0, 0, 1, 0]"
768677435546054656,"Earthquake in Italy: 120 dead, dozens injured and about 150 are missing. Italy, we pray for you! https://t.co/3mAYNKhIQC","[0, 0, 1, 0]"
768675173427916800,Death toll from massive quake in central Italy soars to 247: The death toll from a powerful quake in central ... https://t.co/DJ8o4XGSRk,"[0, 0, 1, 0]"
768661242948956161,159 death tolls. Grabe ganon kalala yung earthquake sa Italy ,"[0, 0, 1, 0]"
768674005662302208,Death toll in Italy quake rises to 247; hundreds injured and missing. ='[ #PrayForItaly &lt;3,"[0, 0, 1, 0]"
768678848007319553,Huffington Post: Death toll from #ItalyEarthquake jumps to nearly 250 https://t.co/CR34RB5C8X : Death... https://t.co/GnCQc1YAvW #NewsInTweets,"[0, 0, 1, 0]"
768634595084496897,#BREAKING news  Over 100 dead in #ItalyEarthquake  https://t.co/j5IAaszUfV,"[0, 0, 1, 0]"
768674802345259008,Death toll from Italian earthquake soars to 247 and is expected to rise further: The death toll in Italy's... https://t.co/Y2Le0xVzMj #dw,"[0, 0, 1, 0]"
768668518363475968,"Death toll rises after devastating quake jostles central Italy, rescue efforts on: AMATRICE, Italy - The death... https://t.co/EMqHnVQQAW","[0, 0, 1, 0]"
768637527796293633,6.2 earthquake in Italy death count nearing 200. #prayforitaly,"[0, 0, 1, 0]"
768682096898433024,"RT: @nytimesworld :Death toll from Italys earthquake rises to 247, the authorities say. Hundreds have been injured. https://t.co/b5uqzUXEw0","[0, 0, 1, 0]"
768647603101794304,Death tolls; Atleast 163 dead and 370 injured in Italy earthquake https://t.co/2IOPSr6Mbm,"[0, 0, 1, 0]"
768682819778441216,"Italy earthquake leaves 247 dead; rescuers race to find survivors, via @CNN. The death toll is still rising... https://t.co/x65YtDk3cX","[0, 0, 1, 0]"
768663498528329728,The Latest: Fewer casualties likely in quake damaged hotel.. https://t.co/FcGAShmsyL https://t.co/jOWPFGChA8,"[0, 0, 1, 0]"
768678659607695360,Breaking: Death toll from earthquake in central Italy rises to 247 people thousands injured,"[0, 0, 1, 0]"
768675543457882112,The death toll from the Italian earthquake has now risen to 247 with 350 more left injured #CapitalReports https://t.co/rMiUDkERUe,"[0, 0, 1, 0]"
768665509810188288,"No Filipino casualties in Italy quake, says government https://t.co/yc9huaiuWn | via @sunstaronline https://t.co/KP3GIC7xwN","[0, 0, 1, 0]"
768678617194856448,"RT ABC: JUST IN: Death toll climbs to 247 after 6.2-magnitude quake in central Italy, 368 injured. ... https://t.co/q2AKeBNQY5","[0, 0, 1, 0]"
768675721195753472,Death Toll Climbs to 247 Afte https://t.co/Y4ZpKvFTKS,"[0, 0, 1, 0]"
768672400196116480,"Rescuers searched through the night for survivors following #earthquake in #Italy.170 people died , 468 were injured https://t.co/kF9bisQqZR","[0, 0, 1, 0]"
768644685866950656,"No Aussies killed, injured in Italy quakeSBS https://t.co/lUhxctiuxZ","[0, 0, 1, 0]"
768674359909031936,The Latest: Italian officials say quake death toll hits 247: Italian authorities say that the death toll from Wednesday's earthquake ...,"[0, 0, 1, 0]"
768649340437004289,"Italy Earthquake Kills 159, Reduces Towns to Rubble: With 368 people injured, some critically, and an unknown... https://t.co/b55fJ7zMrn","[0, 0, 1, 0]"
768666966974341120,160 #people are #dead &amp; at least 368 #injured in #Italy's #earthquake &amp; #rescuers are still digging in. https://t.co/eAwkEIdWcJ,"[0, 0, 1, 0]"
768638404489719808,Earthquake Death Toll Reaches 159 In Italy:  https://t.co/97OjI0uXqR,"[0, 0, 1, 0]"
768679328376692736,NewsAlert: Death toll in Italy quake now 247 https://t.co/43aIZEDz6c,"[0, 0, 1, 0]"
768669966593826817,"Death toll in Italian earthquake rises to 247, report several news agencies","[0, 0, 1, 0]"
768678472797388800,Over 100 killed in deadly Italy earthquake: About 120 people were killed and 368 injured in an earthquake tha... https://t.co/Yw72HBDIjT,"[0, 0, 1, 0]"
768676993080692736,247 is at the moment the death toll of the earthquake the stroke Italy yesterday over 300 injured and thousands... https://t.co/1xSjSSFSfJ,"[0, 0, 1, 0]"
768678479349092352,(Euronews):#Death toll in central #Italy quake rises to 247 : Death toll rises to at least 247 More than 360.. https://t.co/BSbq2UzVkD,"[0, 0, 1, 0]"
768667850022219776,#BREAKING: Italy earthquake death toll reaches 247. RIP,"[0, 0, 1, 0]"
768677957254586369,"Italy Earthquake Over 160 Dead, 370 Injured - https://t.co/tMlYOB8Cxm","[0, 0, 1, 0]"
768644704007294978,"MOAR HORRIBLE NEWS FOR #WOMEN, PROBS: At least 159 dead, 368 others hurt as strong earthquake rocks central Ita... https://t.co/uhw8AOmpB9","[0, 0, 1, 0]"
768678444611825664,"At least 247 killed, over 300 injured &amp; many others trapped under rubble as 6.2 magnitude #earthquake hits #Italy https://t.co/rihI9ek2BK","[0, 0, 1, 0]"
768677293539545088,Number Of Dead In Italy Earthquake Rises To 247: Official: The number of dead in the powerful earthquake in c... https://t.co/3zCf60bOsf,"[0, 0, 1, 0]"
768659722702622720,"No Filipino casualties in Italy quake, says government: NO FILIPINO casualties have been reported so far in t... https://t.co/hFpahb0rtG","[0, 0, 1, 0]"
768671697545400320,Italy earthquake: 247 deaths https://t.co/yNYxzBlZhO,"[0, 0, 1, 0]"
768676089258401792,Death toll in Italian earthquake expected to rise as rescue teams search beneath the rubble: Death toll rises... https://t.co/aldwhNylAn,"[0, 0, 1, 0]"
768671383765209088,This is incredible that 250 now dead in Italy earthquake,"[0, 0, 1, 0]"
768628671405957120,Updated #Italy #Ametrice #Earthquake M6.2 +150 Fatalities +300 Injured @CNN #sismo #temblor https://t.co/EYFk2ZIKPF https://t.co/0frlNAGGoS,"[0, 0, 1, 0]"
768634352796332032,So glad that my relatives in Italy are safe from the earthquake! Unfortunately many are injured and some haven't been found yet,"[0, 0, 1, 0]"
768678626044751872,"""Italy earthquake death toll rises to 247"" https://t.co/Zyc64ltSmS","[0, 0, 1, 0]"
768671658110574592,#ItalyEarthquake: 247 dead; rescuers racing against time: https://t.co/tHJpQEUYnf,"[0, 0, 1, 0]"
768671462047698944,#BREAKING: Italy earthquake death toll climbs to at least 247: AFP (ANI),"[0, 0, 1, 0]"
768678358825730048,"Death Toll Climbs to 247 After Earthquake in Central Italy, 368 Injured - ABC News - https://t.co/YJ9KN5MLGQ via @ABC","[0, 0, 1, 0]"
768685567932506112,Death toll: 247. #earthquake #PrayingForItaly #Amatrice #Accumoli,"[0, 0, 1, 0]"
768723721028669441,Death Toll from Italy Quake Rises to Nearly 250 as Rescuers Work Through the Night: The death toll fro... https://t.co/rT2C2pWdA5 (Time),"[0, 0, 1, 0]"
768686873929658368,"Quake rocks central Italy, 73 dead https://t.co/obhfD1sHI5","[0, 0, 1, 0]"
768734361323642880,"ITALY EARTHQUAKE - Death toll from Italy earthquake rises to at least 247, many still missing: The death toll... https://t.co/yHxkrKod5R","[0, 0, 1, 0]"
768725909809627136,"Podrska italijanskom narodu,stradalom u strasnom zemljotresu..Support the Italian people injured in the earthquake https://t.co/k0LUI3z9NZ","[0, 0, 1, 0]"
768709055011446784,TRAGIC:  Italy earthquake death toll raises to at least 247 people  At least 247 have been confirmed dead after... https://t.co/U4KkSAd5b5,"[0, 0, 1, 0]"
768735466149416962,#BREAKINGNEWS #ITALY #EARTHQUAKE #DEATH TOLL CLIMBS TO 120 https://t.co/TbOJoKbILP,"[0, 0, 1, 0]"
768735891644878848,"@MarkHayter1 thanks, we're all fine here, the quake occurred in the center of Italy. Such a terrible situation, so many casualties.","[0, 0, 1, 0]"
768724904485072896,Death toll in Italian M6.2 earthquake reaches 247: ....The death toll in a strong earthquake in... https://t.co/nrNFi5cD0I #Cyprus #news,"[0, 0, 1, 0]"
768689730028507136,247 deaths in the earthquake #PrayingForItaly keep praying guys,"[0, 0, 1, 0]"
768683167091875842,"#breakingnews After Earthquake in Italy, Half the Town No Longer Exists: Photo An injured man was rescued f... https://t.co/R7jlGSq8Ui","[0, 0, 1, 0]"
768684827147132928,The numebr of dead has risen to 240 after the #earthquake in Italy and at least 368 are injured https://t.co/m5EB79frJf,"[0, 0, 1, 0]"
768726735487545344,"More than 247 people killed, Hundreds injured and missing #EarthquakeInCentralitaly only for strongest heart ::... https://t.co/R61Zt37D0F","[0, 0, 1, 0]"
768711837298851840,No Ukrainians injured or killed as a result of #Italian #earthquak  https://t.co/7rxwkbmUxh https://t.co/9Ad4BN0R9e,"[0, 0, 1, 0]"
768716250717491200,So sad to hear of the Italian earthquake. Our thoughts are with the injured and families of. #ItalyEarthquake,"[0, 0, 1, 0]"
768712302363160576,Italy death toll reaches 247 as rescue continues: The death toll from a devastating earthquake in central Italy rose sharply to almos...,"[0, 0, 1, 0]"
768717648255258627,Earthquake: 247 dead and thousands displaced persons https://t.co/GRIZRbHjSt,"[0, 0, 1, 0]"
768685431042953217,"Death toll in Italy earthquake rises to 247, civil protection agency says - AP: Death toll in Italy earthquake rises to 247, civil pr...","[0, 0, 1, 0]"
768705151532228608,#earthquake #ItalyEarthquake death toll: 247 #victims 264 hospelized injured people gov source says #BREAKING #BreakingNews,"[0, 0, 1, 0]"
768716350290362368,"247 people have died, including many children in earthquake in central Italy+the number continues to rise.  Hundreds injured,many missing","[0, 0, 1, 0]"
768744566203768832,Earthquake in Italy: #267 dead and hundreds injured#.,"[0, 0, 1, 0]"
768690047042322432,#UAE Embassy in Rome states that no UAE casualties among the victims of the earthquake that hit central #Italy. https://t.co/f6p4ovqP0Z,"[0, 0, 1, 0]"
768705416847040512,"Italy Earthquake, did @BBCBreakfast just say that 274 dead?  Horrendous, just horrendous.","[0, 0, 1, 0]"
768738558295224320,Italy quake toll rises to nearly 250 as rescuers struggle to find survivors:   At least 368 injured people ha... https://t.co/gtVggiEh7A,"[0, 0, 1, 0]"
768727024538116096,"BBC : RT bbcthree: Italian earthquake death toll rises to 247, with at least 368 injured. ... https://t.co/Jlmagzuii9) https://t.co/xbvBgI9O4j","[0, 0, 1, 0]"
768720233947246592,Italy earthquake: death toll soars to 247 -  https://t.co/rQ20x3Te4p  The death toll from a powerful earthquake ... https://t.co/us4Ya0K0Mk,"[0, 0, 1, 0]"
768687504241197056,"Italy earthquake death toll rises to 247,search for survivors continue","[0, 0, 1, 0]"
768704460033921024,Italy earthquake death tool raised to 247 | zipi https://t.co/3S5MwX59cm,"[0, 0, 1, 0]"
768683851426258944,#VOWFMNEWS '159 people dead in Italy's 6.1 magnitude Earth quake' #TheMorningShakeUp,"[0, 0, 1, 0]"
768687977405046784,#terremoto MT @ValerioDeC #Italy #Earthquake. Death toll rises to 247. Hundreds wounded &amp; many people still missing. https://t.co/rq0C3i9OzK,"[0, 0, 1, 0]"
768685891707633664,BREAKING NEWS: Death toll from earthquake in Italy now at 247.,"[0, 0, 1, 0]"
768716082379001856,Earthquake Italy: Incredible Tragedy  The 247 the dead https://t.co/TKFiqLHHPj,"[0, 0, 1, 0]"
768726793020968960,ITALY EARTHQUAKE... Death Toll reaches 247... Devastating... https://t.co/qJtd5e4ora,"[0, 0, 1, 0]"
768727342734831616,"@VeraSumanta a terrible earthquake, are 85 dead and I knew some of them","[0, 0, 1, 0]"
768714780173594624,Disastrous Earthquake in Italy caused more than 250 deaths and more than thousand injured #Prayingforitaly #ItalyEarthquake,"[0, 0, 1, 0]"
768729157442338816,"So tragic, death toll rises to 249 in Italian earthquake","[0, 0, 1, 0]"
