tweet_id,text,labels
768269535145185280,"From the BBC:  A magnitude 6.4 earthquake struck central Italy, south of Perugia. No reports of damage or casualties https://t.co/i7Oqvn9Jdt","[0, 0, 1, 0]"
768283243166765056,"JUST IN: Italian Civil Protection Agency says it has received reports of building collapses after quake in central Italy, Reuters reports.","[0, 0, 1, 0]"
768280221673848834,"CONTEXT: The 2009 L'Aquila earthquake (6.4) in central Italy left around 300 dead, 1200+ injured and $16B in damage. - @MicahGrimes","[0, 0, 1, 0]"
768283150992617472,#USGS says preliminary 6.2 mag earthquake has struck central Italy. No immediate reports of injuries. Aftershocks reported. @KHQA,"[0, 0, 1, 0]"
768282846670839808,Still have electricity despite the earthquake here in Italy,"[0, 0, 1, 0]"
768280587626946562,"#terremoto #earthquake, Mayor of #Amatrice: ""The town is no more"". In the epicenter area buildings collapsed and probably people injured.","[0, 0, 1, 0]"
768275115570294788,Houses and old school castles came crashing down near #roma #rome #earthquake #terremoto #amatrice,"[0, 0, 1, 0]"
768279119717105672,TRANS: Many buildings collapsed in Amatrice #terremoto | #Italy #earthquake  https://t.co/g9NHYTNvKe,"[0, 0, 1, 0]"
768282518290325504,"Live: Earthquake at Central Italy, Here below the Yellow mark is Possible Damaging of Buildings &amp; Deaths https://t.co/CERRaEe9O9","[0, 0, 1, 0]"
768277106870607872,"+++ Buildings reportedly collapsed in Amatrice and Accumuli, center Italy, after earthquake #terremoto +++ https://t.co/YOxzhn6bcT","[0, 0, 1, 0]"
768267948959993856,#BREAKING: #Italy government say they are in contact with civil protection about #earthquake near #Perugia. No word on damge or injuries yet,"[0, 0, 1, 1]"
768284017661652992,"(Still unconfirmed): Mayor of Amatrice says road access to the town is cut off following earthquake, people trapped beneath the rubble.","[0, 0, 1, 0]"
768277441651539968,"Witnesses called Rai news to say buildings collapsed in #Arquata, near #Rieti in central #Italy #earthquake #terremoto","[0, 0, 1, 0]"
768269809981284352,"#Quakefeed app: there's just been a #6.2 #earthquake in #Norcia #Italy close to #Rome. Noone dead or wounded, I hope https://t.co/lbMGwk6WjB","[0, 0, 1, 0]"
768272899790606336,UPDATE: Sources firming the #Italy #earthquake was at a 6.2 magnitude. No current reports of damage or casualties. #breaking,"[0, 0, 1, 0]"
768271112044150784,BREAKING: Despite the strong shocks there's no apparent sign of significant damage here in Pescara #earthquake #italy,"[0, 0, 1, 0]"
768283775172083712,Powerful earthquake 6.4 rocks central Italy . Reports of collapsed buildings and extensive damage. Details @GlobalCalgary at 11,"[0, 0, 1, 0]"
768269469848309761,"Earthquake in the middle of the night. Alarms went off, dogs started barking. No damages and everyone's fine here. #terremoto #roma #scossa","[0, 0, 1, 0]"
768275141692313600,"MAGNITUDE 6.2 EARTHQUAKE ROCKS ITALY - SERIOUS DAMAGE, NUMEROUS INJURIES https://t.co/mWr1ByJbep https://t.co/pJnJ3IKpyo","[0, 0, 1, 0]"
768275944175906816," 6.2 m #Earthquake rocks central Italy, no major damage or casualties reported at the point. https://t.co/MLHGbidoH4","[0, 0, 1, 0]"
768270334218891264,"Italy - Travel Alert - 6.2 magnitude earthquake struck near Perugia, no initial reports of damage or casualties #travelawareness","[0, 0, 1, 0]"
768278352167698432,No immediate reports of damage after earthquake rattles Rome and central Italy. https://t.co/A3FPJU50Ze,"[0, 0, 1, 0]"
768282110310305792,"NBCNews - BREAKING: 6.2-magnitude earthquake rocks central Italy No damage or injuries were immediately reported,... https://t.co/Q2mOI3roM8","[0, 0, 1, 0]"
768279822573400064," Italy rocked by ~6.2m #earthquake: no reports of major damage, but grumbles @Corriere news does not mention it! https://t.co/Ohq1v4Ht1B","[0, 0, 1, 0]"
768298589009215492,"#Rieti -heartfelt hopes &amp; wishes. Earthquake rattles central Italy, buildings damaged, people trapped under rubble https://t.co/6HBD13Eido","[0, 0, 1, 0]"
768301262773243904,Retweeted Huffington Post (@HuffingtonPost):  Casualties and significant damage feared after strong earthquake... https://t.co/TIGNrYcBbT,"[0, 0, 1, 0]"
768287585701507072,"Italy quake leaves 5 dead, thousands homeless https://t.co/6HSWUD60K2 via @BostonGlobe","[0, 0, 1, 0]"
768289451445411840,6.1 Earthquake ROCKS ROME ITALY Significant Casualties Extensive Damage https://t.co/NcTEpwKcHX #ItalyEarthquake https://t.co/95T1F7qoVA,"[0, 0, 1, 0]"
768298028558000130,"At least 2 dead in central #Italiy #earthquake, Rai News 24 reports.","[0, 0, 1, 0]"
768294688495329281,"#Italy #Latest At least two killed by 6.0 quake, several injured, trapped on wreckage in #Amatrice #Norcia #ArquataDelTronto #Illica","[0, 0, 1, 0]"
768301838214934529,"UPDATE: Reports of damaged buildings, blackouts, residents fleeing homes near epicenter of 6.1 Italy quake. https://t.co/puTfd1NzWZ","[0, 0, 1, 0]"
768285187851554816,"@ebro75 @lori50207495 ....All right !!! The earthquake occurred in the area of Rome, no serious damage .Thanks !!!","[0, 0, 1, 0]"
768291777170186240,"105.9 SEASIDE-FM News - BREAKING Earthquake rattles central Italy, buildings damaged, people trapped under... https://t.co/Ayn0RPkIep","[0, 0, 1, 0]"
768302125747011589,"Central Italy hit by 6.2-magnitude earthquake, injuries reported: A strong earthquake hit a mountainous area ... https://t.co/2C1r6R8ueO","[0, 0, 1, 0]"
768285679109275648,"#Italy earthquake: Heavy damage in Amatrice, buildings collapse, many trapped https://t.co/sK45HPESbg https://t.co/qlqiOsJLoy","[0, 0, 1, 0]"
768295181980307456,"Central Italy hit by 6.2-magnitude earthquake, injuries reported - Tue, 23 Aug 2016 PST https://t.co/SvzARqmJib","[0, 0, 1, 0]"
768290190372679680,No good news....this earthquake has done a lot of damage...  feeling worried,"[0, 0, 1, 0]"
768303365382037507,"Severe damage was reported in Amatrice, where Mayor Sergio Pirozzi said, Half the town no longer exists. https://t.co/au0Cu5MRyQ","[0, 0, 1, 0]"
768292521046716420,#Breaking: The USGS estimated that significant casualties are likely and that economic loss could be extensive. #CNN #Italy #Earthquake,"[0, 0, 1, 0]"
768288893221216256,Injuries now reported in Ascoli Piceno. #Italy #earthquake,"[0, 0, 1, 0]"
768286942865666048,Collapsed buildings and rubble after earthquake in Italy. https://t.co/CNTGCdn6Qy,"[0, 0, 1, 0]"
768297782725664768,"(The Star):#Central #Italy hit by 6.2-magnitude earthquake, injuries reported : The mayor.. https://t.co/e7hCwkLjEM https://t.co/YFYCmCjbyw","[0, 0, 1, 0]"
768299332558737408,"Magnitude 6.1 #earthquake  hit central Italy. Damaged buildings, blackouts near Rieti https://t.co/4QTKoxScHm https://t.co/CMo0HusHCg","[0, 0, 1, 0]"
768296592948404227,"Strong 6.0+ earthquake hits central Italy, shocks felt in Rome. Communication shut down, casualties unknown:( https://t.co/IQWfUpl6dP","[0, 0, 1, 0]"
768300706113597440,Reportedly at least 2 killed w/many injured after magnitude 6.0 earthquake #Amatrice #Italy People still trapped https://t.co/Hx9CurAlYq,"[0, 0, 1, 0]"
768301087736475650,Two dead in Italy earthquake: TWO people are dead after a magnitude 6.2 earthquake rattled... https://t.co/lvq4ZMrgJT https://t.co/rz7KiA14SO,"[0, 0, 1, 0]"
768287217454309376,"6.4 Earthquake in central Italy. The area is full of historical small towns, building are heavily damaged. Still no info about casualties","[0, 0, 1, 0]"
768302959943757824,"The world is getting the shakes and this time, it's Italy with thankfully no casualties reported: https://t.co/b3JuBmvx1W","[0, 0, 1, 0]"
768304858340274176,#Terni no damages reported. #Italy #Earthquake No se reportan danos ni victimas en Terni. https://t.co/llLtM7MwO7,"[0, 0, 1, 0]"
768314775931592704,Sad news.   Multiple Casualties Reported After Earthquake Strikes Italy https://t.co/bNJNJ7jR45 https://t.co/eUqUB2Yd9p,"[0, 0, 1, 0]"
768304074219335680,BREAKING: Italy rocked by 6.2-magnitude quake that damaged buildings &amp; sent shockwaves as far as Rome 100 miles away https://t.co/gJ1pzmMujx,"[0, 0, 1, 0]"
768325017503281152,Six people dead in quake https://t.co/4ligIt843H,"[0, 0, 1, 0]"
768305795209400320,"Magnitude 6.2 quake strikes Italy; casualties, damage expectedUSGS https://t.co/XlzfpLoay0","[0, 0, 1, 0]"
768330539648552961,Up To 10 dead in Italy early morning earthquake. ,"[0, 0, 1, 0]"
768305277170950145,Retweeted The New York Times (@nytimes):  Strong quakes have damaged central Italy. Half the town no longer... https://t.co/9OG55sxsc2,"[0, 0, 1, 0]"
768317127145119744,"It's a sad world where an earthquake can cause so much damage, and no one cares. Prayers for Italy.","[0, 0, 1, 0]"
768308438610894848,"The Perugia #earthquake was just 10km deep, hence greater concern of damage and casualties in central #Italy","[0, 0, 1, 0]"
768330761342713856,"Woken up in Italy at 3.30am by the earthquake. Quite scary but we were lucky, damage to the house but no-one hurt.","[0, 0, 1, 0]"
768325314179203073,many suffer casualties as earthquake rocks central italy https://t.co/D7U0r1QELV https://t.co/txnFseRnaL,"[0, 0, 1, 0]"
768317328714969088,6.2 magnitude quake hits central Italy. No word yet on the extent of the damage #News https://t.co/13DNnvwWX1,"[0, 0, 1, 0]"
768323478751555584,*AT LEAST 10 DEAD IN ITALY EARTHQUAKE: SKY TG24 #ItalyEarthquake,"[0, 0, 1, 0]"
768308263116877824,Strong 6.2 Earthquake Hits Central Italy: Six people dead &amp; several casualities https://t.co/4WAhRyR6WI https://t.co/waiHMDADfz,"[0, 0, 1, 0]"
768330485902692352,#Earthquake damage in #Italy is severe.  Very early reports at least six dead.  One town reports many dead.  #PrayForItaly,"[0, 0, 1, 0]"
768330285742067712,"14 reported dead as shallow 6.2 quake shakes Rome, devastates towns in central Italy Injuries and Death toll... https://t.co/O0bXv6Mj7v","[0, 0, 1, 0]"
768304836664172546,#Italy #earthquake At least 4 deads in small villages. https://t.co/6Xw04hpZGC,"[0, 0, 1, 0]"
768322210276712448,"Large #earthquake strikes Italy, several casualties. People digging with their bare hands to save  buried #terremoto https://t.co/Pc66D61EvL","[0, 0, 1, 0]"
768313882595168256,"#PrayforItaly Major earthquake this morning! Bridges are out, and can't get emergency vehicles out to the small towns.","[0, 0, 1, 0]"
768320663266492417,"@MistressMueller Good morning My lady ,today is a very sad day for Italy ,in the night an earthquake in center Italy destroy a lot of houses","[0, 0, 1, 0]"
768303914303172608,"Strong 6.2-magnitude #quake rocks central #Italy, reports of damage, casualties. #ItalyEarthquake https://t.co/2nnN91fudA","[0, 0, 1, 0]"
768321123586932736,.@Independent '...said no deaths have been reported deaths in Norci.' #typo https://t.co/VV4zvlXeJp,"[0, 0, 1, 0]"
768311923116953600,Two dead in Italy earthquake. https://t.co/Lp0y1v8Rgk,"[0, 0, 1, 0]"
768317381349343232,6 feared dead in #italy earthquake  https://t.co/h4Go8zJfLL,"[0, 0, 1, 0]"
768352175944716289,"Earthquake in Italy, 14 dead.","[0, 0, 1, 0]"
768339265042255872,"@Sillifunnihappi the earthquake has been felt in Veneto too but no damage if not at the epicenter, in Lazio with Marche and Abruzzo affected","[0, 0, 1, 0]"
768356721936838656,UPDATE: The death toll from central Italy 6.2 mag earthquake now at 13. Officials warn the numbers of deaths will likely rise. @NEWS9,"[0, 0, 1, 0]"
768345179682181120,"#quake in #italy caused extensive damage in #rieti area #amatrice #accumoli suffered worst, death toll uncertain","[0, 0, 1, 0]"
768352065626132480,Death toll climbs from Italy's #Amatrice earthquake. #TenNews https://t.co/RQvvln9YUu,"[0, 0, 1, 0]"
768336576569020416,Ten dead in big Italian quake - The West Australian https://t.co/jfDZ8XnZoR,"[0, 0, 1, 0]"
768354976775176196,A 6.2 Mag Quake Hits Central Italy 22 Dead As Of Now Survivors Are Being Searched Fo Pray Theyr'es No Mo Dead And Aftershocks,"[0, 0, 1, 0]"
768338791597744128,Six dead in #Italy #earthquake RT BBC https://t.co/Tma27140Lh,"[0, 0, 1, 0]"
768347993527377921,Earthquake leaves death and destruction in Italy. https://t.co/EKoQIQwWTO,"[0, 0, 1, 0]"
768344510409519104,"At least 10 people are dead after a 6.2 magnitude earthquake in Central Italy, reports of extensive damage to a number of towns #KIISnews","[0, 0, 1, 0]"
768353441383010304,Italy earthquake: At least 21 dead as officials warn death toll likely to rise: At least 21 people are dead f... https://t.co/BLxNuBJ0t4,"[0, 0, 1, 0]"
768331227245842432,"6.2 #Earthquake in #Italy-Widespread terrible damage to old-style construction. Mayor of #Amatrice says entire town is ""gone"". #PrayForItaly","[0, 0, 1, 0]"
768338250498842624,[earthquake] The earthquake caused severe damage to bridges and buildings in Los Angeles. https://t.co/R5a9thN1XZ #english,"[0, 0, 1, 0]"
768341355210899456,AP: At least ten dead after a magnitude 6.2 earthquake in Italy.,"[0, 0, 1, 0]"
768339254040752128,"+++ At least 100 people unaccounted only in Pescara del Tronto, a village destroyed by a devastating earthquake https://t.co/MCIuOjPZ3y +++","[0, 0, 1, 0]"
768338587196751872,#Breaking| At least 10 people are feared dead in the central #Italy quake,"[0, 0, 1, 0]"
768346450044518400,a man looks at damaged buildings following a 6.2 magnitude #earthquake which hit #Amatrice #Italy   #ItalyEarthquake https://t.co/l2sTtZF5Yo,"[0, 0, 1, 0]"
768348081108770816,"#BREAKING: Latest reports say nearly 10 ppl dead in Italy earthquake, death toll expected to rise. many feared under rubble","[0, 0, 1, 0]"
768334015740858368,@Lilia_Zannoni The earthquake no damage? Family is safe?,"[0, 0, 1, 0]"
768344464377118720,Prayers go for the death of  #Italy #earthquake people.,"[0, 0, 1, 0]"
768340558490120193,Many feared dead as #Italy hit by powerful #quake https://t.co/fN4UZkxLEM,"[0, 0, 1, 0]"
768348966236717056,Five dead as powerful quake shakes Italy: Local officials indicated that the death toll was likely to rise. F... https://t.co/54qtae4Aqn,"[0, 0, 1, 0]"
768338580309618691,6.2 earthquake hits Italy.  Several people dead. https://t.co/cSAl3AO7VK,"[0, 0, 1, 0]"
768358755230711808,Horrible earthquake in Amatrice According to The Guardian 10 dead and CNN 21 dead!! both live news!! https://t.co/QdM1hL6skL,"[0, 0, 1, 0]"
768359955405479936,Multiple Casualties Reported After Earthquake Strikes Italy: 6.2 Magnitude Earthquake Hits Central Italy                             ...,"[0, 0, 1, 0]"
768379992900300800,Update: At least 21 #dead in central #Italy #earthquake.  https://t.co/XbYJzFug1H,"[0, 0, 1, 0]"
768373151696691200,Italian earthquake 21 dead. Northern town 6.2,"[0, 0, 1, 0]"
768364404173901824,"'Strong quake rattles Italy, many feared dead'  https://t.co/bu4ZmAhzu0","[0, 0, 1, 0]"
768357149529350144,"Earthquake update: no damage or injury was reported here. AUR students are arriving, so many were not present. Those present are all safe.","[0, 0, 1, 0]"
768366335466307584,UPDATE: At least 11 people are dead after an earthquake rattled central Italy.,"[0, 0, 1, 0]"
768367217436135424,@ReutersWorld reporting at least 20 deaths now confirmed in Italian earthquake.,"[0, 0, 1, 0]"
768369171654594564,"The earthquake in Italy is awful, over 20 people dead. But over 300 people dead in India from floods &amp; no mention on mainstream aus channels","[0, 0, 1, 0]"
768366433101238272,#UPDATE: #ItalyEarthquake toll climbs; at least 18 dead https://t.co/JpoFqUU8nT,"[0, 0, 1, 0]"
768364113022025729,At least 20 dead as 6.2-magnitude earthquake rocks central Italy in dead of night   A powerful earthquake has... https://t.co/UKU7LD9BEX,"[0, 0, 1, 0]"
768361695274229760,@MsLm_97 an earthquake 6.0 which is so much terrible. there are victims and a lot of people injured. ,"[0, 0, 1, 0]"
768379975133196288,"BREAKING: A Strong earthquake in central Italy, at least 11 dead.","[0, 0, 1, 0]"
768381311006408704,"Death toll will rise. City has been leveled. Strong quake rocks central Italy, at least 23 reported dead https://t.co/hdQ6L1kf2t","[0, 0, 1, 0]"
768363576595656704,#BREAKING: Death toll rising from Italy earthquake.  Listen @wsbradio for updates.,"[0, 0, 1, 0]"
768371848996413440,"A magnitude 6.1 #earthquake struck central #Italy early Wednesday, with reports of damaged buildings and blackouts. https://t.co/Dk9Ay97zNR","[0, 0, 1, 0]"
768373877852344321,"""21 dead in Italy quake"" https://t.co/HMcoXiFv49","[0, 0, 1, 0]"
768358452532015104,3 cities are GONE. We still don't know how many people died. Roads are destroyed and people can't get there to help. #earthquake,"[0, 0, 1, 0]"
768382142309101569,Reuters: AT LEAST 37 DEAD IN ITALIAN EARTHQUAKE - CIVIL PROTECTION SPOKESWOMAN,"[0, 0, 1, 0]"
768368158352605185,"The depth of the Italy earthquake is also 10km/6miles. That's shallow, no wonder the damage is great.","[0, 0, 1, 0]"
768379538741092352,Multiple injures reported after earthquake in Italy.  https://t.co/B4bBF9X4hc,"[0, 0, 1, 0]"
768363726730727424,"#ItalyEarthquake 6.2-magnitude, officials confirm 21 dead, many more injured or missing https://t.co/LqbeVNlUvP https://t.co/99y3HBd4ZE","[0, 0, 1, 0]"
768361056657809409,BREAKING: Central Italy earthquake - now 21 dead https://t.co/XkxkSeYKvd,"[0, 0, 1, 0]"
768388617182056448,The death toll is steadily going up and now stands 38 people dead from the Italian earthquake. You guys are in our prayers. #ItalyEarthquake,"[0, 0, 1, 0]"
768387666387886080,18 dead and scores injured after 6.2 magnitude quake rocks central Italy - https://t.co/0s4kVHiCZr https://t.co/GjLuEjvMZp,"[0, 0, 1, 0]"
768389452150501376,no of casualties rises steadily... horrific Central Italy earthquake: at least 38 dead in 6.2 quake  https://t.co/7dujODEJ9O,"[0, 0, 1, 0]"
768389212030853120,"BREAKING: Earthquake in Italy, 37 dead. https://t.co/MyBEDvcQR8","[0, 0, 1, 0]"
768398743230087168,UPDATE: Death toll climbs to 37. https://t.co/Qwx4bg8y7q,"[0, 0, 1, 0]"
768390697514897408,"No Indian casualty in #Italy #earthquake, tweets @SushmaSwaraj  https://t.co/xIBPuxAnBY https://t.co/KY9g2kQx6F","[0, 0, 1, 0]"
768395748627062784,@dollpuffin okay lng ako &gt;&lt; malapit young region na apektado sa earthquake but no damage/accident was reported in rome,"[0, 0, 1, 0]"
768394791797219329,Death toll from central Italy 6. earthquake reaches 37 at least,"[0, 0, 1, 0]"
768404302113017856,"Italy earthquake leaves 37 dead, towns in ruins - CNN: CNNItaly earthquake leaves 37 dead, towns in ruinsCNNAre you in Italy? Are you...","[0, 0, 1, 0]"
768387842712100864,#Breaking: Number of casualties following earthquake in central Italy rises to 37 https://t.co/wKNNkWSIyW https://t.co/2PwWlPF9yj,"[0, 0, 1, 0]"
768395000052903936,#earthquake shakes #italy. at least 37 dead. https://t.co/3BiHHr6Zzf,"[0, 0, 1, 0]"
768388515944095744,At least 37 dead in #Italy earthquake: Reuters https://t.co/IEoxYCIzxL,"[0, 0, 1, 0]"
768390608486539265,"Amatrice Italy destroyed in 6.2 earthquake this morning. 37 known dead, hundreds injured, thousands unaccounted for as of 1100z","[0, 0, 1, 0]"
768397437673156608,OMG again #Earthquake   #Agartala  #Tripura   - I got injured in my leg :(,"[0, 0, 1, 0]"
768404561253978112,Update on Italy earthquake from USGS - Orange alert level for shaking-related fatalities. Significant casualties are...https://t.co/nxaaIJW9ZN,"[0, 0, 1, 0]"
768403727220781057,"Italy quake: Death toll rises to 37, 150 injured https://t.co/HqB7S6xdy6","[0, 0, 1, 0]"
768391043477704705,"BREAKING- ""Town is No More"" Death toll keeps rising... 37 now confirmed dead in Italy Earthquake North of Rome https://t.co/lr64QCvsrO","[0, 0, 1, 0]"
768389850827456512,#Earthquake #Italy leaves nearly 40 #dead. https://t.co/PDhmoYEwDI,"[0, 0, 1, 0]"
768391747676278784,#ItalyEarthquake: Earthquake strikes in central Italy resulting in multiple casualties https://t.co/iIGOyPmoR6 https://t.co/OhRBPXcgj8,"[0, 0, 1, 0]"
768398768764964864,Number of Casualties After Earthquake in Italy Rises to 38 https://t.co/bhawmjr39F https://t.co/arkqhsHn5f,"[0, 0, 1, 0]"
768405323640176640,deadly earthquake with at least 37 dead and over 60 injured,"[0, 0, 1, 0]"
768393987807858688,Embassy: No Filipino casualties in Italy earthquake | Network News live https://t.co/CaczwF9CtH,"[0, 0, 1, 0]"
768387817948925952,ohh RIP all who dead in Italy earthquake. https://t.co/nF6AKrSaqN,"[0, 0, 1, 0]"
768397673191931904,I want to inform all my friends and people who have contacted me that in my area(VITERBO) there are not injured layers during the earthquake,"[0, 0, 1, 0]"
768394127709011968,Devastating earthquake between Rieti and Norcia. Frightening number of casualties https://t.co/GXEza8cHLA,"[0, 0, 1, 0]"
768424606688481280,63 dead  and counting #Earthquake #Italy https://t.co/suZF0uDmai,"[0, 0, 1, 0]"
768418489690390532,Italian earthquake death toll crosses 50 #terremoto #Italy,"[0, 0, 1, 0]"
768412182522494976,please pray for the poor people of Italy a 6.2 earthquake destroyed many historic buildings hundreds injured unknown killed,"[0, 0, 1, 0]"
768424378681786368,Deadly Earthquake In Italy Leaves 37 Dead https://t.co/d1CO00cVjs,"[0, 0, 1, 0]"
768425906025168897,"@continoops it's an earthquake, 38 dead omg","[0, 0, 1, 0]"
768418475790315521,Death toll climbs after earthquake rocks Italy:  The death toll keeps climbing following an earthquake in Ita... https://t.co/ptjrX0RfUo,"[0, 0, 1, 0]"
768414596352843776,Prayers for Italy. 37 dead after an Earthquake,"[0, 0, 1, 0]"
768425946399461376,"Amusa :- Over 38 dead,  dozens injured, trapped or missing in Italys deadliest quakes: A po... https://t.co/UivDEz9aYB Amusa, W. A news","[0, 0, 1, 0]"
768418389526183936,Praying for the people in Italy after the horrific 6.2 magnitude earthquake. 38 people dead &amp; dozens more injured/missing #ItalyEarthquake,"[0, 0, 1, 0]"
768408275272564736,BIG EARTHQUAKE HITS ITALY WITH 38 DEAD... https://t.co/Gg1CJq9X2T,"[0, 0, 1, 0]"
768406959594799105,death toll reaches 35 in #Amatrice  itself #earthquake  https://t.co/Wz0WU3XSUT,"[0, 0, 1, 0]"
768409635464237056,Earthquake hits central Italy - Over 10 dead https://t.co/AOBF4jVaXG,"[0, 0, 1, 0]"
768423707203207168,#ItalyEarthquake  latest..... 45 dead :( #earthquake https://t.co/dplRAJmPmi,"[0, 0, 1, 0]"
768411263630204928,Escape: An injured man covered in dust is carried out of a crumbling building on a stretcher by a team of rescue ... https://t.co/UCUIVsRTEp,"[0, 0, 1, 0]"
768406947884171264,"Italian #earthquake death toll rises, many missing https://t.co/mhZ9HpAuOU","[0, 0, 1, 0]"
768407144861470720,"Italy earthquake leaves 37 dead, towns in ruins - CNN: CNN Italy earthquake leaves 37 dead... https://t.co/QqpJT0KnvO","[0, 0, 1, 0]"
768409181325893632,#Earthquake in #Italy. Part of my country devastated. Hundreds of deaths and injuries.  Steemit https://t.co/jmzCQezZS6,"[0, 0, 1, 0]"
768407130126835712,37 dead and 150 missing after Italy earthquake civil protection official says.,"[0, 0, 1, 0]"
768411322107195393,Death toll after Italy earthquake keeps climbing. 38 deaths now being reported. https://t.co/eURsfB7Ne9,"[0, 0, 1, 0]"
768415074939797504,Earthquake in Italy: a few dozen casualties (PHOTO) https://t.co/rEhhlaYgaY https://t.co/JwEspjtbYw,"[0, 0, 1, 0]"
768425911079276544,"Twins, 6, found dead in rubble - A PAIR of twins, 6, have reportedly been found dead in the rubble of the Itali... https://t.co/OGDGM8i3hf","[0, 0, 1, 0]"
768410399234482176,Dozens dead after 6.2 earthquake strikes Italy.  Global Warming at fault again.,"[0, 0, 1, 0]"
768426486348910592,"Fresh Update::: Over 38 dead,  dozens injured, trapped or missing in Italys deadliest quakes... https://t.co/LSwJ2lM6el Via @BadManWizz","[0, 0, 1, 0]"
768418896751636480,"37 Killed, 150 Injured As Earthquake Hits Italy https://t.co/vZyEfakRF9","[0, 0, 1, 0]"
768419248351899649,Earthquake disaster in Italy left 18 people dead https://t.co/lYwGrbxqxa,"[0, 0, 1, 0]"
768409400587513856,38 people confirmed dead in major earthquake in central Italy. #PrayforItaly,"[0, 0, 1, 0]"
768415427714179072,There is no report of any Indian casualty in the massive earthquake in Italy  External Affairs Minister Sushma Swaraj said @sudhirchaudhary,"[0, 0, 1, 0]"
768408261821206528,"Death toll in Italy quake climbs to at least 37: Rescue agency says several hundred injured, thousands homele... https://t.co/wKLkHbsiQH","[0, 0, 1, 0]"
768425252577644544,[WATCH] 37 dead after shattering earthquake strikes central Italy https://t.co/r0naYs7esV,"[0, 0, 1, 0]"
768425820272533505,Earthquake in Italy leaves 38 and counting people dead. #PrayforItaly,"[0, 0, 1, 0]"
768412775949271041,Italian earthquake death toll now at least 37 with 150 people missing: Many of the dead were in the village o... https://t.co/kDszP1KEas,"[0, 0, 1, 0]"
768406035442851840,"Earthquake: 37 Dead, 150 Missing in Italy... https://t.co/DnbfTA1cZL","[0, 0, 1, 0]"
768406045886668800,No #Indian casualty in #ItalyEarthquake  https://t.co/Y5TWxrUgqN https://t.co/CXBHNPEURO,"[0, 0, 1, 0]"
768407325032022016,Massive earthquake struck Italy in the middle of the night. 37 casualties. But the American media is stuck on Trump. #ItalyEarthquake,"[0, 0, 1, 0]"
768421840452747264,"The death toll of central Italys earthquake rose to 38, more feared dead under rubble - 17 dead in Amatrice only. https://t.co/8PYchpYBf6","[0, 0, 1, 0]"
768421084915990528,"37 dead... Many others injured, missing following earthquake in Italy. https://t.co/qvzXPma4QO","[0, 0, 1, 0]"
768409067790405632,Dozens Feared Dead After Strong Quake Hits Central Italy ............................................ https://t.co/OZvRpFNih6,"[0, 0, 1, 0]"
768426426634686464,"Over 38 dead,  dozens injured, trapped or missing in Italys deadliest quakes: A powerful pre-dawn earthquake devastated mountain vil...","[0, 0, 1, 0]"
768406647358095361,"Strong Quake Rocks Central Italy, 37 Dead: Strong Quake Rocks Central Italy, 37 Dead https://t.co/574gSj1TFf - from CBN News","[0, 0, 1, 0]"
